{
    "schema_version":  "1.0.0",
    "command_type":  "formal_generation_withdrawal",
    "command_id":  "command.generation.withdraw.001",
    "idempotency_key":  "demo-generation-withdraw-20260801",
    "project_id":  "project.demo",
    "target":  {
                   "record_id":  "record.theory.overlap_stabilized_score",
                   "record_type":  "theory_record",
                   "generation_id":  "generation.theory.overlap_stabilized_score.003",
                   "content_sha256":  "7777777777777777777777777777777777777777777777777777777777777777"
               },
    "expected_target_state":  {
                                  "publication_state":  "formal",
                                  "record_position":  "current",
                                  "record_state_sha256":  "8888888888888888888888888888888888888888888888888888888888888888"
                              },
    "expected_control_head":  {
                                  "current_index_generation_id":  "generation.current_index.041",
                                  "current_index_sha256":  "9999999999999999999999999999999999999999999999999999999999999999",
                                  "last_event_sequence":  44,
                                  "event_root_sha256":  "aaaaaaaaaaaaaaaaaaaaaaaaaaaaaaaaaaaaaaaaaaaaaaaaaaaaaaaaaaaaaaaa"
                              },
    "reason":  {
                   "code":  "scientific_correction",
                   "explanation":  "A material proof dependency was found to be unsupported, so this exact formal theory generation must not remain eligible for current use."
               },
    "requested_by":  {
                         "user_id":  "researcher.demo",
                         "operating_actor_type":  "authorized_remote_operator",
                         "operator_id":  "operator.hermes.demo",
                         "delegation_id":  "delegation.withdrawal.001"
                     },
    "content_sha256":  "a6342ca3f0b17c3b051cee2d88ff5e4163ee7fc804e841888f0189d7e3882ba1",
    "requested_at":  "2026-08-01T17:00:00Z"
}